{
  "artifact_id": "analysis.synthetic.cmh_summary",
  "scope": {
    "step_id": "09",
    "scope_type": "analysis",
    "scope_id": "synthetic_analysis"
  },
  "adapter": "step09_cmh_summary_v1",
  "expectation": {
    "required": true,
    "source_path": "tests/fixtures/artifact_schema_v1/source/results/editing/synthetic_analysis/synthetic_analysis.cmh_summary.tsv"
  },
  "availability_status": "present",
  "completion_status": "complete",
  "state_reason": null,
  "source": {
    "path": "tests/fixtures/artifact_schema_v1/source/results/editing/synthetic_analysis/synthetic_analysis.cmh_summary.tsv",
    "sha256": "5555555555555555555555555555555555555555555555555555555555555555",
    "size_bytes": 123,
    "row_count": 1,
    "media_type": "text/tab-separated-values"
  },
  "parameters": {
    "control_condition": "EV",
    "treatment_condition": "PUM1"
  },
  "metrics": [
    {
      "metric_id": "candidate_count",
      "name": "Candidate count",
      "value": 2,
      "unit": "rows",
      "status": "not_assessed",
      "source_artifact_id": "analysis.synthetic.cmh_summary"
    }
  ],
  "warnings": [
    {
      "code": "production_evidence_unavailable",
      "message": "This record is a synthetic fixture and is not production evidence.",
      "related_artifact_ids": [
        "analysis.synthetic.cmh_summary"
      ]
    }
  ],
  "errors": []
}
